標題,網址,內文
肺癌術後飲食,https://www.chimei.org.tw/main/cmh_department/59012/info/5600/A5600232.html,"衛教單張 肺癌術後飲食 By 營養科 | July, 2024 目的 對於肺癌病人給予早期營養支持的介入，預防或改善營養不良，增加身體及免疫系統之功能。 適用對象 肺癌手術及接受化學治療／放射線治療的病人。 飲食原則 病人手術後，通常需要他人幫忙翻身、咳嗽及呼吸訓練，而胸部疼痛或手臂乏力、呼吸短促是常見的術後副作用，因而影響病人的食慾及進食狀況。 一般而言，術後第一天即可進食，但仍視恢復狀況而定。飲食無特殊限制，應攝取足夠的蔬菜、水果，避免活動量減少而發生便秘。 術後1~2週若有胸部傷口疼痛的狀況，應採用溫和軟質飲食，少量多餐的方式，減少咀嚼。 若有咳嗽或是痰黏稠的問題，病人應避免刺激性的食物（菸、酒、辣椒、花椒、芥末等）及冰冷食物；偏寒涼性的食物（白蘿蔔、瓜類、柑橘類）宜烹調食用為佳，注意禁食甜點、冷飲與可樂、咖啡等甜膩的食物。 依病人其生理代謝改變的需求，建議如下： 儘早給予均衡飲食的營養支持。 給予高熱量、高蛋白飲食計畫。 如無法到達營養攝取量，可考慮採用商業配方營養品來補充（或指示食用）。 避免煙燻及臘肉等製品。 治療引起之副作用及飲食技巧 病人治療時產生副作用之營養支持，依不同的治療方式而異。 ※放射線治療 常會引起食道黏膜的傷害，飲食上須注意避免過熱、刺激、帶酸味的食物；嘗試涼飲可緩解病人的疼痛。食物質地應以滑嫩、柔軟，避免過粗過硬為主。 ※化學治療 病人因化學治療可能產生的副作用包括：噁心、嘔吐、食慾不振等。飲食可藉由增加進食頻率補足每日應達熱量需求或食用熱量較濃縮的食物，佐以食用少許開胃食物、飲料（如：酸梅湯、洛神茶、果汁），增加烹調變化性，並視病人狀況予以鼓勵餐前做適度的活動等。 特殊營養素的支持 某些營養素對於肺癌術後病人的營養狀況有改善的效果，在均衡飲食的原則下，您可以考慮增加攝取，這些特殊營養素可分為以下幾類： 蛋白質： 支鏈胺基酸(BCAA)： 不會刺激癌細胞的蛋白質合成。食物來源以黃豆蛋白含量最高。 精胺酸(Arginine)： 補充精胺酸可干擾癌細胞的蛋白質合成。食物中以巧克力、堅果類、全榖雜糧類和蛋白質食物中含量豐富。 免疫促進配方： 市售商業配方有些會添加麩醯胺酸（Glutamine）、精胺酸（Arginine）、核苷酸（nucleic acid）、Omega-3脂肪酸，在部份癌症檢驗指標有改善，但臨床影響仍不明確。因此營養補充原則仍建議以天然食物為主，營養配方為輔的策略。 維生素：葉酸、維生素B6、維生素C (一)蛋白質對癌細胞及宿主的影響 在營養素供應減少時，癌細胞比正常細胞更容易奪取營養素，尤其是氮（nitrogen），因此癌症病人的蛋白質補充是有其必要性的。切勿聽信不當偏方，忌食含蛋白質食物。 (二)脂肪酸對癌細胞及宿主的影響 魚油及中鏈脂肪酸（MCT）：可以改善宿主的蛋白質代謝、增加體重、改善氮平衡(食用量建議與討論)。 脂肪酸：魚油存在於深海魚中如：鮭魚、鱈魚、秋刀魚（ω-3脂肪酸）及中鏈脂肪酸（MCT）如：統一綺麗健康油、三多MCT配方-F、益富麥格拉、日清MCT能量粉末及日清MCT能量油。 (三)微量營養素的攝取 肺癌會降低體內不同維生素的儲存量，包括： β類胡蘿蔔素 維生素A 維生素C 維生素B2、B6、葉酸 要達到均衡的營養素攝取，首從蔬菜類及水果類中攝取天然的營養素為佳 （引用：Nutr Clin pract:2005 ; 20 :451）。 食譜範例 肺部術後一日飲食 2000大卡／88克蛋白質 餐次 菜名 材料 早餐 蛋餅 豆漿 蛋１顆‧巿售餅皮1片‧小白菜約2／3碗‧油1／3匙免洗湯匙 約300cc 午餐 五穀飯 煎鮭魚 炒紅蘿蔔小黃瓜肉絲 菠菜 山藥雞湯 蘋果 五穀飯1碗 鮭魚2兩‧油1／3匙免洗湯匙 肉絲1兩‧紅蘿蔔約1／3碗‧小黃瓜絲約1／3碗‧油1／3匙免洗湯匙 菠菜約半碗‧油1／3匙免洗湯匙 雞腿丁1兩‧山藥1／4碗 小蘋果1粒 晚餐 薏仁飯 迷迭香牛排 白果什錦蒸豆腐 地瓜葉 金針竹笙排骨湯 柳丁 薏仁飯1碗 牛肉2兩‧馬鈴薯半碗‧油2／3匙免洗湯匙‧迷迭香少許 傳統豆腐半塊‧白果少許 地瓜葉約2／3碗‧油1／3匙免洗湯匙 排骨1兩‧竹笙1/4碗‧金針少許 柳丁1粒 蛋白質一份=肉1兩=魚1兩=傳統豆腐半塊(或嫩豆腐半盒)=無糖豆漿190c.c.=鮮乳240c.c. ～諮詢電話～ ││電話：281-2811轉52514 │柳營奇美│電話：622-6999轉72517 │佳里奇美│電話：726-3333轉32512 ││ 電話：281-2811轉52514 │柳營奇美│ 電話：622-6999轉72517 │佳里奇美│ 電話：726-3333轉32512"
小腸切除術後飲食,https://www.chimei.org.tw/main/cmh_department/59012/info/5600/A5600233.html,"衛教單張 小腸切除術後飲食 By 營養科 | July, 2024 小腸的生理功能 成人的小腸長度在3到6公尺之間,為食物消化和吸收營養的主要場所，吸收營養物質的能力無法滿足身體所需時就會產生營養不良的情形。 小腸切除對腸道的影響 正常小腸長度： 總長度：365~700公分 十二指腸：20~30公分 空腸：200~300公分 迴腸：300~400公分 營養素吸收減少，須注意血液生化值的檢查，異常者視需要補充。如： 十二指腸切除會影響鈣及鐵的吸收。 空腸切除會影響銅、鋅及葉酸的吸收。 末端迴腸切除會影響膽鹽及維生素B12的吸收。 結腸切除會影響鉀、鈉、氯及水分的吸收。 胃酸分泌過多。 腸胃道蠕動增加；造成腹瀉。 腸切除術飲食進展 腸切除後的營養照顧，必須依腸切除的部位及長度等因素，做不同的處置。通常剩餘的小腸在100公分以上，或只切除空腸而未切除迴腸者，都可適應的不錯。 剩餘的小腸在120~180公分或90~120公分而結腸者還存在： 可能需要使用TPN（全靜脈營養）約1~6個月。 60~90公分而結腸者還存在，易有中、重度營養素吸收不良： 可能需要使用TPN（全靜脈營養）約6~12個月。 若剩餘小腸小於60公分，易有嚴重營養素吸收不良： 可能需要終生使用TPN（全靜脈營養） ※ 對於腸切除病人的營養照顧，需視個別情況隨時調整，一般可分為三階段： 第一階段 （約為術後3天至7天） 剛手術後，必須完全依賴靜脈營養（如：葡萄糖或胺基酸溶液、脂肪溶液） 第二階段 （1週之後） 可由等張或低張的液態食物，稀釋的元素飲食或半元素配方，來增進腸道適應力。當可以接受後再增加半流質食物（如：稀飯、軟質鹹粥、軟質蔬菜等），最後再逐量增加各種固體食物（如：飯、菜、肉）。當病人由口攝食逐漸增加時，可以逐量減少靜脈營養。 第三階段 （腸道適應期已完成泛指術後5個月左右，甚至到1年） 可以由口攝取大部分的營養時，最好還是避免食用含酒精或咖啡因的飲料，因為這些食物都會刺激腸蠕動。 ※ 各類營養素含量豐富的食物 營養素 食物 鋅 肝臟、肉類與雞肉。堅果與扁豆 葉酸 蛤蠣、肝臟、深綠色蔬菜（菠菜、蘆筍、甘藍菜）、豌豆、酪梨 維生素B12 肝臟、蛋、乳品、牛肉、豬肉 鉀 水果：酪梨、香蕉、椰子、哈蜜瓜、乾果 蔬菜：焗豆、甜菜、西蘭花、甘藍、高麗菜蛋白質食物：黑豆、蛤蠣、龍蝦、鮭魚、沙丁魚 如需進一步的營養照護，會診或掛營養科門診。會視您的疾病徵狀，給予您個別的飲食建議！ ～諮詢電話～ ││電話：281-2811轉52514 │柳營奇美│電話：622-6999轉72517 │佳里奇美│電話：726-3333轉32512 ││ 電話：281-2811轉52514 │柳營奇美│ 電話：622-6999轉72517 │佳里奇美│ 電話：726-3333轉32512"
放化療治療飲食,https://www.chimei.org.tw/main/cmh_department/59012/info/5600/A5600245.html,"衛教單張 放化療治療飲食 By 營養科 | June, 2024 一、原因 本飲食為改善及增加癌症病人接受化放療時營養攝取的一種飲食。 二、目的 減輕化放療所引起阻礙進食之相關副作用。 攝取足夠營養，預防營養不良。 提升生活品質。 三、適用對象 癌症接受化放療病人。 四、常見副作用之飲食原則 ※ 噁心、嘔吐 避免太甜、太油、含濃烈辛香料或辣味之食物。 選擇較清淡食物，如：吐司、蘇打餅乾、麥片、軟質蔬果等。 選用酸性食物，如：酸梅、醬瓜等可降低噁心感。 口含薄荷糖、檸檬糖等，可改善噁心感及口腔異味。 若有晨嘔問題，起床後可先吃乾吐司或蘇打餅乾。 吃接近室溫或較冰冷的食物。 吃正餐時，勿喝大量液體，以免因飽脹感而造成噁心。 少量多餐並放慢進食速度。 ※ 味覺或嗅覺改變 可使用多種不富含蛋白質的食物，但要注意避免腥味。如：肉類、鮮魚類、蛋、豆製品、奶類及其製品（可與蔬菜如菠菜、高麗菜一起烹煮以增加風味並降低腥味）。 利用調味料來改變食物味道： 可將肉類用酒或調味料加以醃漬改變風味。 可使用酸味、甜味較強的調味料，如：檸檬汁、醋、糖等。 食物中可添加蔥、蒜、九層塔、香菇、洋蔥、八角、當歸、肉桂等香辛料以增加食物風味。 將食物放冷至室溫食用。 ※ 食慾不振 少量多餐。 可於正餐時先吃固體食物再補充液體食物，可避免過度飽脹感。 高營養濃度或喜愛的食物應優先進食。 在身體較舒適的時刻多攝食，例如：接受化療之前或兩次治療間。 盡可能參與日常活動，飯前可稍微散步以促進腸胃蠕動。 ※ 口乾 以食物促進唾液分泌： 攝取較甜的食物，或檸檬水等飲料(口腔疼痛病人不適用)。 口含糖果、八仙果或咀嚼口香糖。 改變食物的質地或製備方式： 選用軟質或細碎的食物以利吞嚥。 將食物拌入湯汁或以芶芡方式烹調，如：湯麵類、燴飯、將餅乾或麵包浸入牛奶中食用等。 每日攝取8~12杯水。 使用護唇膏以保持嘴唇的濕潤。 五、口腔黏膜發炎、疼痛 選擇質地軟嫩、細碎的食物，如：乳酪、奶昔、絞(碎)肉、鮮魚、豆腐、蒸蛋、軟質蔬菜水果等。 改變食物製備方式，如：可將食物剁碎、煮軟、芶芡等。 避免刺激性食物，如：酒精飲料、碳酸飲料、酸味強之飲料、調味重之香辛料、醃漬類或溫度過高之食物、粗糙生硬的食物。 利用吸管進食流質食物以減少碰觸傷口機會。 進食高熱量、高蛋白食物以利傷口癒合。 使用麩醯胺酸，幫助口腔黏膜生長。 經常漱口，去除食物殘渣及細菌，保持口腔衛生有助傷口癒合。 ，進食前使用麻醉性漱口藥水以減輕進食所引起的疼痛。 ※ 白血球減少 製備食物前後或進餐前，需以肥皂及溫水洗淨雙手。 分開砧板切菜、肉，使用後須徹底清潔與消毒。 只吃煮熟的食物，避免生食或烹煮不完全的食物。 水果須先削皮後食用。 飲用煮沸過的水，避免生水及瓶裝水。 進餐剩餘的食物應於2小時內冷藏，食用前須加熱處理，並於24小時內吃完。 保存食物須注意，熱食應維持於60℃以上，冷食於4℃以下。 攝取足夠營養。 ※ 腹瀉 注意水分及電解質的補充。 少量多餐。 避免攝取油膩、高纖維或含刺激性成分之食物。 限制奶類及乳製品食用。 益生菌可增加腸道中有益菌，可改善腹瀉症狀。 急性腹瀉後，應先採清流質飲食，以補充腹瀉期間身體水分的流失，並讓腸道休息。 倘若腹瀉問題持續或更嚴重，。 ※ 便秘 補充水分： 喝足夠的液體(如：開水、果汁、湯品等)，每天至少須8～10杯(每杯240c.c.)，以使糞便軟化。 如廁前30分鐘可喝1杯溫開水以促進排便。 補充膳食纖維，多選用高纖維食物，如：全穀類、新鮮水果及蔬菜。 其他有利改善便秘食物： 果寡醣有促進腸胃蠕動功能，可加入流質食物內飲用。 含有益生菌之食物或補充劑可改善腸道菌叢生態。 梅子汁、黑棗汁、決明子茶、咖啡等具輕瀉作用。 每日適度運動。 是否使用軟便藥物。 如需進一步的營養照護，會診或掛營養科門診。會視您的疾病徵狀，給予您個別的飲食建議！ ～諮詢電話～ ││電話：281-2811轉52514 │柳營奇美│電話：622-6999轉72517 │佳里奇美│電話：726-3333轉32512 ││ 電話：281-2811轉52514 │柳營奇美│ 電話：622-6999轉72517 │佳里奇美│ 電話：726-3333轉32512"
膀胱癌術後飲食,https://www.chimei.org.tw/main/cmh_department/59012/info/5600/A5600247.html,"衛教單張 膀胱癌術後飲食 By 營養科 | July, 2024 膀胱癌定義 90%的膀胱癌是屬於移形性上皮細胞癌。從膀胱內皮層延伸出去並侵犯膀胱肌肉層，也屬於侵犯性膀胱癌。可能會穿過膀胱生長並侵犯到鄰近器官。若癌細胞侷限在膀胱內皮層，則稱之為表淺性膀胱癌。經過治療後，表淺性膀胱癌可能會復發，且大部分會以其它的表淺癌症復發。 膀胱癌的臨床症狀 在早期並無明顯症狀，有些人會出現痛性或無痛性血尿、頻尿、尿急、尿痛、小腹脹痛、腰痛、排尿困難的症狀。 ※手術治療方式： 經尿道膀胱腫瘤切除術（適用於零期與第一期） 膀胱局部切除術 根除性膀胱切除術合併尿路改道術（迴腸導管最常用） 術後可能引起的併發症 飲食調整 腎盂腎炎（代謝性酸高氯血症） 多喝水，避免攝取過多蛋白質 脂肪便 低油飲食，注意烹調方式 貧血 多攝取深紅色肉類（豬肉、牛肉）、深綠色蔬菜 飲食治療目標 期望病人藉由正確的飲食觀念達到良好的營養狀況。 手術後飲食原則 術後病人排氣後可即早進食，先以試喝溫開水，若無不適可經由流質飲食後進展成軟質飲食。 術後要多攝取水分，增加小便量，維持排便的順暢，而日常飲食需多攝取新鮮蔬果，避免因用力解便造成傷口的出血。 在食物的選擇要避免攝取易產氣的食物（地瓜、洋蔥、高麗菜…），也不要咀嚼口香糖，以免腸胃道過度產氣造成腹脹與腹部不適。 術後保健 儘量不要吃含防腐劑及醃漬的加工食物，均衡飲食且多選擇六大類食物之新鮮食材。 多喝水（每日2000c.c.，可減低致癌物在膀胱的濃度）。 定時排尿（勿憋尿）。 多攝取新鮮的蔬果及富含纖維質成分之食物（富含維生素A、B6、C）。 避免攝取高脂肪食物。 不吸菸。 少接觸染料與有機溶劑。 有助改善病情的營養素及其來源 營養素 食物來源 維生素A 魚肝油、肝臟、黃色蔬菜 維生素B6 全麥麵包、糙米、瘦肉、牛奶、蛋、肝臟、酵母、香蕉 維生素C 柑橘類水果、番石榴、青椒、甘藍菜 纖維質 芹菜、竹筍、蔬菜 一日飲食建議菜單 早餐 五穀米漿240c.c.、全麥土司2片、煎荷包蛋一個大蕃茄1個（切片） 午餐 燕麥飯、清蒸鱸魚、炒百菇肉片、炒青花菜、大黃瓜湯、奇異果1個 晚餐 什錦蔬菜拉麵（蔬菜拉麵、文蛤、草蝦仁、肉片、小白菜）木瓜一飯碗量（或番石榴小1個） 晚點 安素含纖1罐（或低脂奶＋麥片） 若術後還須接受化療、放療或標靶治療的病人則需要注意治療後所引起的不適反應（食慾不振、噁心 、嘔吐⋯等症狀，可參考本科各式飲食衛教單張或手冊）。若病人體重有明顯減輕時，可至本院營養 科門診諮詢以改善營養狀況。有好的營養補充有足夠的熱量與蛋白質，才能提升身體免疫力來 改善病情。 如需進一步的營養照護，會診或掛營養科門診。 會視您的疾病徵狀，給予您個別的飲食建議！ ～諮詢電話～ ││電話：281-2811轉52514 │柳營奇美│電話：622-6999轉72517 │佳里奇美│電話：726-3333轉32512 ││ 電話：281-2811轉52514 │柳營奇美│ 電話：622-6999轉72517 │佳里奇美│ 電話：726-3333轉32512"
攝護腺疾病術後飲食,https://www.chimei.org.tw/main/cmh_department/59012/info/5600/A5600248.html,"衛教單張 攝護腺疾病術後飲食 By 營養科 | July, 2024 攝護腺在體內的位置與功能 攝護腺（前列腺）位於在尿道末端近膀胱處。男性攝護腺常見的疾病有攝護腺炎、良性攝護腺增生（亦稱攝護腺腫大）、攝護腺癌。這些疾病會導致男性泌尿系統功能的障礙，包括容易膀胱感染和尿道狹窄等問題。 疾病種類 一、良性攝護腺增生（BPH）？ 俗稱為攝護腺肥大，較常發生於50歲以上的男性。攝護腺肥大的病人，因腺體過大壓迫到尿道和膀胱，造成儲尿容積量減少，解尿時無力、中斷或尿不乾淨、小便頻率增加（夜間尤甚），這些都是常見的症狀。 二、攝護腺癌 早期的攝護腺癌通常沒有任何症狀，等到有局部侵犯或遠端轉移時，才會有症狀出現，如骨盆腔淋巴結轉移會造成下肢水腫、骨頭疼痛或體重減輕等。有些症狀與攝護腺肥大很相似，需進一步檢查來確認。 臨床症狀： 解尿無力、中斷或尿不乾淨 夜間頻尿 排尿有疼痛或灼熱感 射精時疼痛 血尿或精液裡帶血 下背部、臀部或大腿上段不明的疼痛或僵硬 治療方法及飲食注意事項： （1）放射線治療： 因治療部位較接近腸道，可能造成腹瀉或頻尿及解尿不適狀況，在治療區域的皮膚會變紅、乾、壓痛感和搔癢。此時須以軟質飲食為原則，且避免食用刺激性的食物。 （2）化學治療： 因藥物治療產生的副作用影響進食，請參考本院營養科編印之化放療飲食衛教單張與手冊來改善。 （3）手術治療（根除性切除或內視鏡刮除術）。 根除性切除術後飲食進展 症狀 飲食進展 排氣後 先試喝白開水（應避免奶類、刺激性飲料，如：酒類、咖啡因） 無腹脹、腹痛、嘔吐 可開始米湯等清流質食物→逐漸進展稀飯、麵條等軟質飲食→正常飲食（此時採少量多餐的進食原則） 預防便秘 便秘易引起傷口出血 進展至正常飲食階段，應有適度的纖維攝取（多吃全穀雜糧、蔬果等）以利排便，且應有足夠水分，建議白天宜多飲用白開水建議尿量2000cc，維持尿路通暢。 採用內視鏡刮除術的病人，經由尿道操作，下腹部無傷口，通常術後的1~2天若無腹脹則可先喝水，飲食進展較快能夠達到正常飲食。 術後建議多攝取抗氧化營養素之食物每日均衡攝取六大類食物 採全穀雜糧類取代精緻白米飯。 選擇低脂動物性蛋白質或以黃豆蛋白（豆腐／豆漿）。 烹調清淡低脂，以植物油清炒或橄欖油涼拌，避免高溫油炸、油煎等方式。 適度運動，每週應達3次以上（例如：簡單散步）。術後三個月內不宜太劇烈運動，避免騎機車，提重物，跑步等。 維持適當的體重。 多攝取各種抗氧化營養素以維持身體免疫力。 抗氧化營養素 食物來源 維生素C 奇異果、柑橘、草莓、芭樂 維生素E 小麥胚芽、南瓜子、堅果類、新鮮植物油 β-胡蘿蔔素 紅蕃茄、紅蘿蔔、枸杞、紅棗 類黃酮素 菇類、大蒜、黃豆、牛蒡、山藥、蘆筍 吲哚類 綠花椰菜、洋蔥、高麗菜、甘藍菜、白菜 建議食譜 早餐 (低糖)豆漿一杯、全穀雜糧麵包一個 午餐 十穀飯一碗、蘆筍炒紅蘿蔔蒟蒻一碟、香烤南瓜子風味鮪魚、蒜味蛤蠣湯 蘋果中型一顆 晚餐 薏仁南瓜燉飯、蕃茄炒蛋、涼拌綠花椰四季菇、鮮魚湯 土芭樂1個 ～諮詢電話～ ││電話：281-2811轉52514 │柳營奇美│電話：622-6999轉72517 │佳里奇美│電話：726-3333轉32512 ││ 電話：281-2811轉52514 │柳營奇美│ 電話：622-6999轉72517 │佳里奇美│ 電話：726-3333轉32512"
鼻咽癌飲食照護,https://www.chimei.org.tw/main/cmh_department/59012/info/5600/A5600249.html,"衛教單張 鼻咽癌飲食照護 By 營養科 | July, 2024 鼻咽癌的好發族群 地區：好發於中國南方。 遺傳（鼻咽癌家族史）：家族中有人罹患鼻咽癌，發生率是一般人6~10倍，若一等親中有罹患鼻咽癌者，則提高至60~100倍。 檢測有EB（Epstein-Barr）病毒。 飲食習慣：常食用醃製品、醬菜類、發酵品，則有較高的罹病率。 喜好吸菸、喝酒、嚼檳榔者：因長期刺激鼻咽表皮較易致癌。 鼻竇炎病史者：鼻咽癌罹患率是常人的3倍。 營養治療的目標 維持體重，避免體重流失大於10%，若副作用較嚴重時，可在治療期間採取過渡性的管灌方式。 增強病患在治療期間的體力與免疫力。 改善放射線及化學治療的副作用。 治療期間的營養 ※放射線治療： 口乾 因放療破壞唾液腺分泌，口水減少，可多補充水分或使用保濕凝膠、漱口水。 可利用菇蕈類（各種菇類／木耳）或山藥等含植物黏蛋白的天然食材，或選擇瓜類蔬果（絲瓜、冬瓜、小黃瓜。）等水分含量較豐富的食材，一起燉煮；除選擇滑嫩質地的食物外，可利用芶芡、燉、滷等烹調，或添加油脂涼拌等方式，增加食物入口的滑順度。 口腔黏膜炎、唾腺炎：通常開始治療後一至二週內發生口腔黏膜變薄、萎縮而至潰瘍 禁食刺激性食物（如：酸、辣、油煎油炸導致食物過度堅硬的烹調方式）。 採溫和、軟質、流質、易消化飲食。 食用富含鋅的食物或補充麩醯胺酸，可降低黏膜炎的嚴重度。 保持口腔清潔，依醫護人員指導使用漱口水漱口。 嚴重疼痛時，遵醫囑使用止痛藥水，一般於進餐前15至30分鐘前使用，以利舒緩進食疼痛感。 味覺改變：對於甜味感覺減弱，對酸、苦等味覺異常，吃東西會感到金屬味、鹹味 選擇富含鋅、硒（如：洋菜、小麥胚芽、南瓜子、黑芝麻、松子、豬肉、蛋黃、肝臟、牡蠣）等食物。 利用洋蔥、檸檬汁、薄荷等天然香料入菜。 若對肉類敏感，可選擇蒸蛋、蒸魚、黃豆製品、高蛋白粉等補足人體蛋白質的需求量。 ※化學治療： 噁心、嘔吐 採少量多餐方式，隨時準備方便食用的小點心。 可優先吃喜愛的食物或高熱量食物。 正餐先吃固體食物，湯品慢點喝，避免喝湯過度飽脹。 開立的止吐藥。 腹瀉及腸黏膜受損 避免過度油膩、高脂及油炸品的食物。 避免含纖維量高的食物，如生菜、粗菜梗。 避免含咖啡因飲品，如咖啡、濃茶、可樂。 此時可多攝取低渣、軟質、含鉀量高、易消化的高蛋白、高熱量食物。例如：蛋、乳酪、水果凍、香蕉、蘋果汁、葡萄汁、白麵包、白吐司、馬鈴薯。 若選用添加麩醯胺酸的產品，需注意以＜40℃ 的溫冷水或果汁沖泡。 保持口腔清潔，依醫護人員指導使用漱口水漱口。 嚴重疼痛時，遵醫囑使用止痛藥水，一般於進餐前15至30分鐘前使用，以利舒緩進食疼痛感。 味覺改變：對於甜味感覺減弱，對酸、苦等味覺異常，吃東西會感到金屬味、鹹味 選擇富含鋅、硒（如：洋菜、小麥胚芽、南瓜子、黑芝麻、松子、豬肉、蛋黃、肝臟、牡蠣）等食物。 利用洋蔥、檸檬汁、薄荷等天然香料入菜。 若對肉類敏感，可選擇蒸蛋、蒸魚、黃豆製品、高蛋白粉等補足人體蛋白質的需求量。 ● 高熱高蛋白～草莓甜飲品 食 材 草莓1碗＋鮮奶240c.c.＋布丁半顆（忌奶者，可換成無糖豆漿190c.c.） 方 法 將所有材料放入果汁機中打勻，即可飲用。 營養小語 230大卡／蛋白質12公克 依季節變化可不同的當季水果 ● 提振食慾～鹹口味濃湯 食 材 馬鈴薯50g半顆＋豬肉1兩＋松子（或核桃）＋綠花椰菜20g(約1朵）＋食鹽1／4小匙＋高湯 200c.c. 方 法 將所有食材煮熟或放入電鍋蒸熟，然後將食鹽及高湯及所有煮熟的食材放入果汁機攪打即可 營養小語 190大卡／蛋白質9公克 ● 刺激味覺～海鮮蒸蛋 食 材 雞蛋1顆＋鮮蝦仁2尾＋鯛魚片1兩＋蛤蠣1～2顆＋鮮奶100c.c. 方 法 將蛋打散拌入鮮奶，加上適量的鹽巴調味，放入電鍋蒸至表面凝固，將其他海鮮放入蒸蛋上，再蒸至全熟即可 營養小語 熱量220大卡／蛋白質18公克 利用鮮奶做蛋汁提高熱量及營養價值，同時使蒸蛋的口感更滑嫩，海鮮含有較豐富的鋅，讓乏味的飲食帶來不一樣的口味變化。 ～諮詢電話～ ││電話：281-2811轉52514 │柳營奇美│電話：622-6999轉72517 │佳里奇美│電話：726-3333轉32512 ││ 電話：281-2811轉52514 │柳營奇美│ 電話：622-6999轉72517 │佳里奇美│ 電話：726-3333轉32512"
