標題,網址,內文
老年雄性激素部分缺乏,https://www.ca2-health.com/mets?p=1576,"疾病介紹 PADAM （partial androgen deficiency in aging male ，老年雄性素部分缺乏症）。男性40歲以後，隨著年齡增長，睪固酮(Testosterone)濃度會以每年4~6%速率遞減。所以俗語說四十歲剩一張嘴，乃是經驗之談。 男性更年期是一個錯誤稱呼，實際上叫低睪固酮症會更貼近事實。 睪固酮減少，在男人身上是漸進性的變化，使男人性慾減少些許、勃起能力差強人意、體力大不如前每每飯後想睡覺、工作易感倦怠、有些人會沒意願再參加戶外運動減少、甚至身體自覺缺乏活力、甚至容易感覺悲傷、逐漸肌肉減少、身體脂肪增多特別是長出鮪魚肚。 症狀 逐漸產生性欲下降的困擾。 勃起功能障礙，舉而不堅，艱而不挺。 自覺活力減退、容易焦躁不安、時常情緒低落。 生活喪失以往樂趣、工作專注力下降。 工作效率減退、時有睡眠障礙等。 第二性徵退化。 骨質疏鬆、全身脂肪比例增加。 發生睪丸萎縮與男性女乳。 病因 主要原因還是年齡 續發性的原因 危險因子 併發症 當睪固酮不足時，會影響到生活品質，更會增加罹患勃起功能障礙的機會、也容易得到代謝症候群、糖尿病、骨質疏鬆症與骨折、及心血管疾病等危險性。 診斷及化驗 檢查睪固酮（testosterone）宜在早上8~10點間進行抽血，下午的數據比較不可靠。 條件許可，使用精密儀器查驗free testosterone可以更準確診斷性腺功能低下（hypogonadism）的存在。 檢查與評估流程一般如下： 治療方法 當您懷疑男性荷爾蒙缺乏時，通常應抽血測睪固酮，白蛋白和性荷爾蒙結合球蛋白來評估。 確定晨間的游離睪固酮值缺乏者，如果沒有禁忌症，當然可以考慮補充。 睪固酮替代療法的兩個目的: 過去建議肌肉注射給藥，每2～4星期注射一次長效的睪固酮，血中濃度波浪起伏較大。 口服的睪固酮（testosterone undecanoate, Restandol）每日一至二次，穩定，但昂貴。 睪固酮貼片曾經風行一時，在台灣因為流汗多，貼片容易掉落造成吸收較不穩定，濕熱的氣候也容易於貼片處產生皮疹，可能較不適合當做首選。 自費選項裡，近年來睪固酮藥膏，因為方便使用和容易隨身攜帶，使用起來也是相當不錯的方式。 藥物 雄性荷爾蒙補充製劑國內常見有下列: 庚酸睪固酮(testosterone enanthate) 兩週施打150 到200mg 劑量。 環戊丙酸睪固酮(testosterone cypionate)，每週施打75 到100mg 的劑量。施打劑量則隨年齡以及體重而有不同，施打時間從每週一次至每月一次不等。 十一酸睪固酮，testosterone undecanoate），成人每次注射1000 mg，每三個月注射一次即可。 在評估整體狀況後，也可能開立口服劑給您，一般情況下可能使用40 mg十一酸睪固酮（testosterone undecanoate），每日服用。 居家照護及追蹤 後續追蹤：跟據鄰國KOSAR Recommendations（韓國老人學研究醫學會)的建議 第1個月： 檢驗其testosterone值是否達到期望水準，是否產生不良的併發症或藥物異常反應，觀察更年期症狀是否獲到適宜的改善。 第3個月： 進行第二次的問卷評量及睪固酮檢測；同時，再經由CBC、PSA、DRE等檢測來測定是否產生身體異常反應。進行空腹抽血檢查脂肪值、肌肉的質量比以及身體脂肪檢測。 第6個月： 除做問卷評量及臨床實驗室檢查外，還要做肝功能及尿液檢查。 建議作骨質密度（bone density）的檢測。 第12個月： 除做問卷評量、睪固酮、DRE、CBC、PSA、尿液、肝功能等檢查外，可能還要考慮透過血糖、糖化血紅素AlC等來檢測血糖值是否正常。 進行骨質密度檢測。 後續追蹤： 治療前兩年內每隔六個月檢查一次，以後每年一次。 若發生了以下情況時要暫停使用或調整劑量，並且預約回診評估： 心臟病徵候群。 PSA超過0 ng/dl。 DRE呈現異常或患有攝護腺癌。 血紅素過高症（polycythemia）或hematocrit高於52%時。 下泌尿道症候群惡化時。 體重上升並出現水腫現象。 空腹血中脂肪值異常。 預防 社會資源 中華民國內分泌學會 11217台北市北投區石牌路二段201號中正樓11樓525室 電話：2874-6354、2874-6138傳真： 2874-6124 【撰文/ 新陳代謝科 】"
高血脂介紹,https://www.ca2-health.com/mets?p=1579,"一、疾病/狀況介紹 Introduction 由於現代人，長期忙碌於工作、缺乏規律的運動加上攝取高油脂、高熱量的飲食等，長期下來，讓健康出現了問題-「高血脂」。所謂『高血脂』就是指血中脂肪代謝異常的意思 高血脂可能引發的相關危險除了心臟血管疾病外，也與腦血管疾病(俗稱中風)有關，當然也與高血壓及糖尿病等慢性疾病有所相關。 常見高血脂的原因可分為 二、症狀 Symptoms 患者的皮膚或皮下組織會出現黃色瘤（Xanthoma）或黃斑瘤（Xanthelasma），或是少部份嚴重高血三酸甘油脂症患者會併發急性胰臟炎而導致上腹痛。 三、病因 四、 危險因子 Risk Factors 五、併發症 Complications 可能引發的相關危險除了心臟血管疾病外，也與腦血管疾病(俗稱中風)有關，當然也與高血壓及糖尿病等慢性疾病有所相關。 六、診斷及化驗 Diagnosis and Laboratory Tests 抽血檢查若血中總膽固醇過高，三酸甘油脂、低密度脂蛋白膽固醇偏高、高密度脂蛋白膽固醇濃度偏低，任一異常或合併多種異常皆可稱為高血脂或血脂異常。 七、治療方法 Treatments 八、藥物 Medications 膽固醇合成抑制劑(statins)： Statins抑制膽固醇合成的初步速率限制步驟的酵素HMG-CoA reductase， 可以降低肝細胞內膽固醇的合成；並藉由增加肝細胞LDL受器數量， 而降低低密度脂蛋白的血漿濃度，同時也減少低密度脂蛋白與血管壁或血液細胞發生反應的量，是目前被認為效果最好的藥物。 肌炎是罕見的副作用 (與gemfibrozil、cyclosporine、niacin或erythromycin併用時會增加危險性。) 其他副作用還包括肝功能指數上升、肌肉痠痛等。 纖維酸衍生物(fibric acid derivatives)： Fenofibrate ,gemfibrozil增加膽固醇分泌至膽汁的量， 因而增加由糞便的流失量；也升高周邊脂蛋白分解酵素的活性， 加速周邊組織脂肪的移行並促進肝臟回流量，其降低血液三酸甘油脂 的程度大於膽固醇。 副作用是可能造成膽石症、不整脈。 Fenofibrate較不會影響 statin 的代謝, 若要與statin 類藥物合併使用應選擇Fenofibrate Ezetimibe﹕ Ezetrol為新降LDL口服錠劑，其作用機轉為抑制膽固醇以及相關植物固醇 在腸胃道的吸收，進而達到降低血中膽固醇及低密度脂蛋白之作用 (約可降低低密度脂蛋白18至20%)。 九、營養 Nutrition 飲食原則簡單說明 十、居家照護 十一、預防 Preventions 避免上述的危險因子, 控制飲食、減輕體重、增加運動等。 十二、社會資源 Social Resources 行政院衛生署高血脂防治手冊 www.tas.org.tw/userfiles/prevention.pdf 十三、病人 Q&A Q: 我吃完降血脂藥物產生肌肉痠痛而且尿液變成茶色應該怎麼辦？ A: 可能是降血脂藥物出現的副作用，建議回門診抽血追蹤。 【編輯/ 蔡秉宸】"
飲食原則,https://www.ca2-health.com/mets?p=1585,飲食原則 油脂攝食過量，不但會造成肥胖更會引起高血脂、高血糖等病症，增加心血管疾病及糖尿病的發生率。藉由限制飲食中脂肪的攝取量，以降低血中三酸甘油脂濃度，或降低胰臟及腸道的負荷，以減少對膽囊的刺激。 適用對象 一般原則 維持理想體重。理想體重的算法=【身高（公尺）2 × 22】±10% 應避免含高油的食物： 【資料來源： 衛教健康分享網】
利腎飲食迎向勝利人生,https://www.ca2-health.com/mets?p=1588,台灣被稱為「洗腎王國」，根據行政院衛生署國民健康局的統計，國內透析人口比例高的原因包括老年人口增加，肥胖、糖尿病、高血壓等慢性病患者人數逐年攀升，以及國人用藥習慣不當、健保實施後降低民眾透析門檻且透析醫療品質佳、腎臟移植率低等等因素有關。 腎臟病分為急性與慢性，一般而言，慢性腎病 需要長期控制，以延緩末期腎病的發生。造成慢性腎病的可能因素如糖尿病腎病變、腎絲球腎炎、高血壓腎病變、遺傳性腎臟病等。國家衛生研究院近期發表的研究顯示，根據台灣地區老人營養健康狀況調查1999-2000年統計分析結果，65歲以上老人慢性腎病罹患率提高的可能因子包括高齡、高血壓藥物的使用、蛋製品及貝殼類食物與肥肉、皮的攝取等，因此已服用降血壓藥物者若合併攝取過多貝類食物或較少攝取黃豆製品，可能使得罹患慢性腎病的危險性大增。 慢性腎病患者必須做好飲食控制 在慢性腎病的飲食控制方面，為避免不適當的攝取造成腎臟代謝負擔，美國腎臟基金會在腎臟病療效品質指引（K／DOQI）中建議，長期穩定接受血液透析的患者，每日的蛋白質攝取量為每人每天每公斤體重2克，其中50%須來自於高生物價的蛋白質，例如奶、蛋、魚、肉類及其黃豆製品。至於劣質的蛋白質如豆類、核果類、麵筋製品等，宜減少攝取。 依此換算，以體重50公斤的成人而言，每天約需攝取60克蛋白質；而長期穩定腹膜透析的病人因流失較多蛋白質，建議每天每公斤體重攝取3克，不可少於2克，並應提供50%的高生物價蛋白質；尚未透析的慢性腎衰竭患者，在早期腎功能不全時，妥善控制飲食中的蛋白質，可以減少尿毒產生，進而延緩腎功能的衰退，故建議限制每天每公斤體重攝取6-75克的低蛋白飲食，其中1/2-2/3以上須來自於優質蛋白質，其餘蛋白質則由五穀類及蔬菜水果來提供。 在低蛋白飲食下，為維持患者營養狀況，必須配合足夠的熱量攝取。這時可用BMI 為標準，BMI=體重（Kg ） ÷ 身高2（m），17以下表示過瘦、18-24為正常範圍，24-26屬於過重，27以上為肥胖。在維持理想體重的前提之下，應達到每天每公斤體重攝取30-35大卡的熱量。由於受到蛋白質的限制，每日所需熱量可由低氮澱粉類（如：粄條、米苔目、蘿蔔糕、冬粉、米粉、粿子條、粉條、碗粿、粉皮、粉圓、西谷米、河粉、澄粉、太白粉、藕粉、涼粉等）、精製醣（如：砂糖、果糖、冰糖、蜂蜜等）與油脂類（如：橄欖油、沙拉油等）提供。 低蛋白飲食也能美味可口多變化 利用上述食材及商業配方，可做出許多美味可口且多變化的低蛋白食品。以下提供幾種製作簡單的低蛋白食譜作為參考： 善用市售低蛋白食品來增加熱量 製作時，可依建議添加糖飴或益補等低蛋白配方來增加熱量攝取，亦可選用下列市售低蛋白食品（但若為糖尿病腎病變患者，則不適合含糖量高的市售點心）： 含磷、鈉、鉀高的食物不能多吃 此外，患者因為腎功能衰退，腎臟排除廢物及電解質的能力都降低，所以在磷、鈉、鉀方面的攝取亦需控制。 磷對於腎臟會造成一定程度的損傷，當血液中鈣磷不平衡時，骨鈣會釋出而形成腎性骨病變，也可能引起皮膚搔癢等症狀，並且磷離子除於血液中外，尚存在於細胞中，會影響透析的效果，故須限制攝取。 含磷高的食物可概分以下幾類： 患者應盡量避開高磷但蛋白質不佳的食物，並於用餐時配合使用磷結合劑。除蔬菜水果等含磷量低的食物之外，均建議搭配磷結合劑同時攝取。 鉀離子大部分（＞95%）會由尿液排泄，僅小於5%的比例是由糞便排出，因此血鉀不平衡也是腎病患者很常見的情形。但在未透析的慢性腎衰竭患者中，當肌酐酸清除率大於30，血鉀仍可維持平衡，因此第3-4期的患者不需嚴格限鉀，除非血清鉀離子濃度偏高或尿量少於1000ml。血液透析患者則須嚴格限制鉀離子的攝取，包括避開高鉀食物、菜湯、肉湯，並勿使用代鹽與低鹽醬油、中草藥等。 飲食中減少鉀離子吸收的秘訣 日常飲食要減少鉀離子的攝取有個小祕訣，因鉀離子易溶於水，且普遍存在於各類食物中，因此請注意下列各種食材的處理原則： 適合慢性腎衰竭的低鉀水果 腹膜透析患者因其透析液中不含鉀離子，可完全交換，所以若無高血鉀則不需特意限鉀。但若其有高血糖，因鉀離子無法攝入細胞內，故須注意鉀離子的平衡。 患者減少水分攝取的小技巧 當患者有便秘症狀，應多活動，並養成規律的排便習慣。此外，患者因水分排除不易，還需減少攝入的水量。慢性腎衰竭未透析患者如有水腫情形，應注意水分的攝取，其攝取量為前日尿量加500-750c.c.；透析患者則須控制在兩次透析間的體重增加小於乾體重的5%。減少水分攝取有些小技巧： 除水分外，鹽分亦不宜過量攝取，建議1天約2-7克，但糖尿病腎病變患者則約6克（3克鈉）。採用低蛋白飲食的患者，因食物分量較少，飲食中可以有正常的調味，但醃製、加工仍須避免。 可選用適當的營養補充品 在種種嚴苛的飲食限制與味覺改變下，食慾不振或過量攝取的狀況在腎臟病患中屢見不鮮，因此為積極控制與延緩病情進展，可藉由口服營養補充品的方式，選擇適當的商業配方來達到保健目的，並提供營養需求。 商業配方的選擇應視病情而定，大體而言，未透析的慢性腎衰竭患者需維持適當熱量並控制蛋白質攝取量，因此可使用洗腎前配方，限制電解質（如：磷、鉀）及水分，做為補充營養的來源。透析後的腎病患者，或是腎移植、飲食中需限制磷、鉀、水分者，可選用洗腎後配方，做為需要熱量濃縮、適量蛋白質及低電解質飲食病人的營養補充品。 【撰文/ 臨床營養科 羅詩晴】
代謝-社會保險資源,https://www.ca2-health.com/mets?p=1603,先天性免疫不全症 健保諮詢服務專線：0800-030598 健保局中區業務組:04-22583988 需終身治療之全身性自體免疫症候群，如: 紅斑性狼瘡、全身性硬化症、類風濕關節炎、多發性肌炎、乾燥症等 健保諮詢服務專線：0800-030-598 健保局中區業務組:04-2258-3988 一般社會保險資源 紓困基金貸款 健保局愛心轉介 分期繳納 向就診的健保特約醫療院所提出申請 出具村（里）長開立之無力繳納健保費之清寒證明書 就醫地與戶籍地不在同一縣市、無家屬或親友可代為申請清寒證明書、或因情況特殊取得清寒證明書顯有困難者，得由就醫之醫療機構查明認定後出具之。 健保諮詢服務專線：0800-030-598 健保署中區業務組:2258-3988 勞動部勞保局傷病給付查詢電話:2396-1266轉2236 勞保局網站 勞動部勞保局職災傷病給付查詢電話:2396-1266轉2236 勞保局網站 被保險人於保險效力開始後，停止前發生職業傷病事故，並符合「勞工保險被保險人因執行職務而致傷病審查準則」規定，需門診或住院者。 被保險人在保險有效期間發生職業傷病事故，於保險效力停止後1年內需門診及住院者。 被保險人在保險有效期間發生職業傷病事故後，於依「被裁減資遣被保險人繼續參加勞工保險及保險給付辦法」及「職業災害勞工醫療期間退保繼續參加勞工保險辦法」規定參加勞工保險期間，需門診或住院者。 【編輯/ 社會工作室 賴宛瑜社工師、蔡佩君社工師】
甲狀腺亢進,https://www.ca2-health.com/mets?p=1647,小敏是個認真努力的百貨公司專櫃小姐，每當周年慶時總能拿到令人羨慕的銷售冠軍獎金，但是，一向活力十足的她，自6個月前開始，整日感到全身無力，心臟加速亂跳，雙手發抖，莫名地食慾大增、無法控制的疲累感，再加上夜裡難眠無法入睡，過去穩定溫柔的個性變得焦躁不安，經常情緒失控，面對這樣的自己，小敏感到相當憂慮，某日因連續周年慶檔期，身心壓力大增，突然間她覺得自己快要喘不過氣，喉嚨總梗著甚麼東西，雙手不自主顫抖無法好好的為客人介紹產品，一時嚇到，掛急診，後來經過檢查才發現自己的甲狀腺機能亢進，才造成上述一連串的症狀。 王媽媽，近來經常感到胸悶心悸，後來找上了心臟科治療，後來又發現自己經常失眠、潮熱、盜汗、面潮紅，猜想應該是更年期到了，就不以為意，直到某天看見電視節目上面提及造成胸悶心悸的原因有許多，做了健康檢查，才發現自己甲狀腺指數異常。 以上兩者均是臨床上常見的甲狀腺亢進的病例。甲狀腺疾病於台灣是非常常見內分泌疾病，罹患率僅次於糖尿病，甲狀腺機能亢進是因為甲狀腺分泌過多的甲狀腺素，是個擾人的文明病，常發生在20-40歲的青壯年人口上，女性較男性常見。甲狀腺，負責掌管身體的新陳代謝和成長，可刺激心跳、呼吸、促進腸胃蠕動、加快神經肌肉的反應、刺激產熱及氧氣的利用、促進骨骼新陳代謝、增強自主神經作用，當甲狀腺素分泌過多會使身體基礎代謝率加速，甲狀腺亢進多與遺傳及體質相關，但是擁有這樣的遺傳及體質並不一定會發病，而壓力是誘發疾病的關鍵因素，壓力包括生理和心理兩方面，如：意外傷害、生病、熬夜或過於忙碌等，此外，攝入過多的碘也可能會引發甲狀腺機能亢進。 甲狀腺亢進臨床上常見的症狀為甲狀腺腫大、心跳加速、眼球凸出、手掌較濕熱、怕熱、手抖、冒汗、疲勞、月經不規則、排便次數多、食慾增加、體重減輕等，但也有可能表現出體重增加或心律不整，甲狀腺亢進的症狀非常多樣化，表現不盡相同，患者常會因個別症狀至各科做症狀治療，如果懷疑自己可能罹患甲狀腺機能亢進，想進一步確認，檢查，簡單抽血就可以知道了。 甲狀腺亢進屬於中醫醫學 “癭病” 的範疇。一般多認為與情志失調以及體質因素、飲食水土失宜、勞累過度等因素有關。其病理因素為氣滯、肝火、痰凝，而以氣鬱為先，初起多實證，久病則多氣陰兩虛或虛實夾雜，與肝、心、腎、脾、胃中醫臟腑關係密切，中醫治療目標在於改善症狀，根據個人體質調節免疫功能，紓解身心壓力，使其不易再復發。 甲亢可區分為下列幾種證型並選用穴位治療： 平時穴位按摩保健可選用太衝、行間、合谷、水突、神門、大陵、三陰交、內關、間使、太谿，另可再搭配耳穴按摩，如：內分泌、激素、皮質下、肝、心、胃、腎，緩柔按壓，每次3分鐘，一日可進行1-2次。 飲食及生活習慣宜忌: 不熬夜、不晚睡、調適心情及生活步調、避免烤、炸、辣食物及避免大量食用含碘豐富的食物，海產類如:海哲皮、海帶、昆布、紫菜、髮菜、海藻、蛤蜊、海水魚、螃蟹、蝦，或刺激及熱性食物如：洋蔥、大蒜、酒、補酒、補藥、羊肉、咖啡、茶、麻油、龍眼、荔枝、榴槤等。此外，若有服用綜合維他命習慣者應注意是否會攝取過量的碘。 【撰文/ 中醫針灸科 】
高危險妊娠-孕期高血壓,https://www.ca2-health.com/mets?p=1638,孕期高血壓是指先前血壓正常的婦女，在懷孕20週以後，血壓值超過140/90mmHg。這種血壓的變化，必須是測量兩次以上均得同樣的結論，而且兩次間隔至少要六小時。 孕期高血壓可能引發子癇前症，俗名又叫妊娠毒血症，懷孕婦女大約有5%的機率會發生子癇前症。 以前診斷子癇前症的定義包括高血壓、尿蛋白與水腫，在產前檢查時都會做尿液試紙檢查，以得知是否出現尿蛋白。近來認為有很多正常孕婦也會有水腫，因此不再將水腫當成診斷的條件，但若是孕婦 有較嚴重，特別是出現於手部或臉部的水腫，仍應考慮可能有子癇前症。子癇前症若出現全身性痙攣則是子癇症。 子癇前症有2/3發生在初產婦，或是有子癇前症的家族病史、糖尿病、慢性高血壓及腎臟疾病的孕婦，都比較容易得到子癇前症。年齡太輕的產婦及高齡產婦、多胎懷孕及葡萄胎的孕婦，也是子癇前症的高危險群。 血壓上升是子癇前症最主要的症狀，隨著血壓尤其是舒張壓上升，蛋白質在腎絲球的濾過增加，蛋白尿開始出現。由於血壓升高，血管壁通透性改變，使得過多的水份滯留在組織中，造成全身性水腫。一般在懷孕期間也會因血液回流受阻而造成水腫的現象，這類水腫主要分布在下肢，抬高腿部可以改善症狀；而子癇前症的水腫是分佈在全身，尤其是臉、手部，且不會因姿勢改變而消失。 除了血壓上升、蛋白尿和全身性水腫以外，子癇前症的病人也可能出現血液及凝血因子方面的病變；包括血小板減少、紅血球變形、血漿凝血因子減少、凝血時間延長等現象。 子癇前症的孕婦也可能影響到肝臟功能，造成肝指數上升。子癇前症如果沒有得到控制，嚴重時會引發孕婦抽筋，也就是進展為子癲症，子癇症的抽筋是屬於大發作的表現，在懷孕的過程中、產程中、甚至產後期都有可能發生。 孕期高血壓形成原因不明，主要病變是由於全身性血管攣縮造成。而血管攣縮的結果進而使血液量減少，胎盤的功能會變得比較不好，而對胎兒生長造成影響，胎兒體重過輕、羊水過少、胎盤剝離、胎兒窘迫等都容易發生在孕期高血壓的孕婦身上，對胎兒的健康影響很大。 所以要預防孕期高血壓所引起的併發症，就是每一次產前檢查都需要測量血壓及檢查尿蛋白，希望能提早發現孕期高血壓並及早治療。 建議在家中休息，減少活動量，每日注意水腫狀況，密切監測血壓變化，必要時以口服降血壓藥物控制血壓。 飲食的控制要維持高蛋白的飲食來補充尿中流失的蛋白質，勿吃太鹹或含鈉高之食物，以減少水腫的危險，但並不需要嚴格限鹽。 一旦孕婦出現下列症狀，是嚴重的子癲前症徵兆，可能需要馬上住院觀察及治療。 住院後，除了使用降低血壓藥物，也會視情況需要給予硫酸鎂以預防痙攣的發生。不過血中鎂濃度必須維持⼀一定的治療濃度範圍以避免副作用，因此要經常抽血檢測鎂離子濃度，以及注意孕婦深部肌腱反射、呼吸速率，及排尿量。 妊娠高血壓最後的治療方式就是中止懷孕，如果出現難以控制的高血壓、肝功能異常、血小板下降、腎功能異常、肺水腫、全身痙攣、腦出血、子癇症、超音波檢測出臍帶血流阻力明顯升高、胎兒生長停滯或胎兒窘迫症情形則必須儘快讓小孩子生產出來。 一般妊娠高血壓在生產後12 週內會逐漸回復正常血壓。若持續高血壓，應做徹底檢查。另外子癇前症在下次懷孕時可能會復發，反覆妊娠高血壓的婦女將來變成慢性高血壓的機率也比較高。 【資料來源： 衛教健康分享網】
